0947|nine forty-seven|Right. . . nine forty-seven and nine forty-eight. They died at the same time.<br/>"That's not the same time, Harry."<br/>I waved a hand, impatient.
0947|09:47|When I’m hungry again I check Watch but he only says 09:47. Cartoons are over so I watch football and the planet where people win prizes.
0947|9:47|Finally at 9:47, the call came. Elaine answered, listened for a second, then silently handed me the receiver. “I want you to be my Secretary of State.”
0947|9:47 a.m.|9:47 a.m. Or gone to Las Vegas and got married.
0947|9.47 in the morning|Normally I would have been at school at 9.47 in the morning, but I had a doctors appointment with an ear, nose and throat specialist, who was going to tell me why I suffered so many sinus infections.
0947|9:47 a.m.|9:47 a.m. (35 minutes captive)<br/>1 lighter, 3 bottles of vodka, 1 pair of scissors, no plan.
0947|9:47|At 9:47 the next morning, the Tamarack County Sheriff's Department received a call. Cork and McDougal were the first to arrive on the scene.
0947|thirteen minutes to ten|For Hunter, who was trained to note times exactly, the final emergency started at thirteen minutes to ten.
