1615|4:15 P.M.|4:15 P.M.<br>Viewed through the window of the Purple Line train, the southbound Howard stop on the El was crowded—but less so than the northbound side, clustered with the first bloom of suburban commuters, weary from their early mornings and afternoon caffeine and blood sugar crashes.
1615|quarter past four|I remember the dread with which I at quarter past four<br/>Let go with a bang behind me our house front door
1615|quarter past four|It is only a quarter past four, (shewing his watch) and you are not now in Bath. No theatre, no rooms to prepare for. Half an hour at Northanger must be enough.
1615|4:15|Must have the phone disconnected. Some contractor keeps calling me up about payment for 50 bags of cement he claims I collected ten days ago. Says he helped me load them onto a truck himself. I did drive Whitby's pick-up into town but only to get some lead screening. What does he think I'd do with all that cement? Just the sort of irritating thing you don't expect to hang over your final exit. (Moral: don't try too hard to forget Eniwetok.) Woke 9:40. To sleep 4:15.
1615|quarter past four|On the tenth day of October at quarter past four in the afternoon with a dry hot wind blowing through the passes Maria found herself in Baker. She had never meant to go as far as Baker, had started out that day as every day, her only destination the freeway. But she had driven out the San Bernardino and up the Barstow and instead of turning back at Barstow (she had been out that far before but never that late in the day, it was past time to navigate back, she was Out too far too late, the rhythm was lost) she kept driving.
1615|4.15|The sun had begun to sink in the west, and the shadow of an oak branch had crept across my knees. My watch said it was 4.15.
